{
  "$schema": "https://json-schema.org/draft/2020-12/schema",
  "$id": "https://agentpetcompanion.local/schemas/agent-event-ingest.schema.json",
  "title": "Agent Pet Companion Strict Event Ingest",
  "description": "The fail-closed boundary accepted by agent.ingest after a raw hook adapter has normalized session-scoped display data. Bounded reasoning, commands, tool input/output, errors, and raw activity details may cross through activity_content; complete transcripts, credential stores, auth headers, environment dumps, and arbitrary envelope fields remain excluded. Deprecated title/detail and payload_json aliases are type-checked but normalized again and never trusted as display or persisted vocabulary.",
  "type": "object",
  "required": ["source", "event_type"],
  "properties": {
    "id": { "type": ["string", "null"], "minLength": 1, "maxLength": 256, "pattern": "\\S", "x-maxUtf8Bytes": 256 },
    "source": { "enum": ["codex", "claude_code", "pi", "opencode"] },
    "project_path": { "type": ["string", "null"] },
    "session_id": { "type": ["string", "null"], "maxLength": 256, "x-maxUtf8Bytes": 256 },
    "event_type": { "enum": ["start", "tool", "waiting", "review", "done", "failed"] },
    "title": { "type": ["string", "null"], "deprecated": true },
    "detail": { "type": ["string", "null"], "deprecated": true },
    "payload": { "$ref": "#/$defs/strictEnvelopeInput" },
    "payload_json": { "$ref": "#/$defs/strictEnvelopeInput", "deprecated": true },
    "created_at": { "type": "string", "maxLength": 128, "x-maxUtf8Bytes": 128 }
  },
  "not": { "required": ["payload", "payload_json"] },
  "additionalProperties": false,
  "$defs": {
    "strictEnvelopeInput": {
      "type": "object",
      "properties": {
        "schema_version": { "const": "apc.agent-event.v1" },
        "external_event_id": { "type": ["string", "null"], "minLength": 1, "maxLength": 256, "pattern": "\\S", "x-maxUtf8Bytes": 256 },
        "source_event": { "type": ["string", "null"] },
        "tool_name": { "type": ["string", "null"] },
        "outcome": { "type": ["string", "null"] },
        "contract_version": { "type": ["string", "null"], "maxLength": 128, "x-maxUtf8Bytes": 128 },
        "diagnostic": { "type": "boolean" },
        "affects_activity": { "type": "boolean" },
        "turn_id": { "type": ["string", "null"], "maxLength": 256, "x-maxUtf8Bytes": 256 },
        "session_active": { "type": "boolean" },
        "message_role": { "type": ["string", "null"], "enum": ["user", "assistant", null] },
        "message_content": { "type": ["string", "null"], "maxLength": 4096, "x-maxUtf8Bytes": 4096 },
        "activity_kind": {
          "type": ["string", "null"],
          "enum": ["thinking", "plan", "command", "file", "file_change", "tool", "subagent", "search", "network", "image", "compaction", null]
        },
        "activity_content": { "type": ["string", "null"], "maxLength": 1024, "x-maxUtf8Bytes": 1024 },
        "interaction_kind": {
          "type": ["string", "null"],
          "enum": ["approval_required", "input_required", "review_required", null]
        },
        "project_label": { "type": ["string", "null"], "maxLength": 128, "x-maxUtf8Bytes": 128 },
        "session_title": { "type": ["string", "null"], "maxLength": 160, "x-maxUtf8Bytes": 160 },
        "session_open": { "type": ["boolean", "null"] },
        "session_surface": {
          "type": ["string", "null"],
          "enum": ["chatgpt_app", "claude_app", "opencode_app", "cli_terminal", "unknown", null]
        },
        "terminal_app": {
          "type": ["string", "null"],
          "enum": ["warp", "terminal", "iterm2", "ghostty", "unknown", null]
        },
        "session_open_url": {
          "type": ["string", "null"],
          "maxLength": 256,
          "x-maxUtf8Bytes": 256,
          "pattern": "^(warp|warppreview)://session/[0-9A-Fa-f]{32}$"
        }
      },
      "additionalProperties": false
    }
  }
}
