{
  "id": "evt_session_display",
  "source": "codex",
  "session_id": "session-display",
  "event_type": "waiting",
  "payload": {
    "schema_version": "apc.agent-event.v1",
    "external_event_id": "evt_session_display",
    "source_event": "PermissionRequest",
    "tool_name": "shell",
    "outcome": "permission_requested",
    "diagnostic": false,
    "turn_id": "turn-display",
    "session_active": true,
    "message_role": "user",
    "message_content": "请保持当前会话消息",
    "interaction_kind": "approval_required",
    "project_label": "agent-pet-companion"
  },
  "created_at": "2026-07-13T00:00:00Z"
}
