{
  "id": "strict-ingest-known-1",
  "source": "codex",
  "project_path": "/tmp/project",
  "session_id": "session-1",
  "event_type": "tool",
  "title": "RAW_TITLE_COMPATIBILITY_ALIAS",
  "detail": "RAW_DETAIL_COMPATIBILITY_ALIAS",
  "payload": {
    "schema_version": "apc.agent-event.v1",
    "external_event_id": "strict-ingest-known-1",
    "source_event": "PreToolUse",
    "tool_name": "Bash",
    "outcome": "started",
    "diagnostic": false
  },
  "created_at": "2026-07-10T00:00:00Z"
}
